{
  "schemaVersion": "scoremosaic-polyphonic-benchmark-fixture-v1",
  "fixtureId": "poly_fixture_openscore_osl_04_p1",
  "granularity": "page",
  "location": {
    "pageIndex": 0
  },
  "source": {
    "sourceId": "openscore_lieder_osl_04_render_p1",
    "sourceSha256": "9aaf65b083f6a2c4a312331251900fd1aabb95c00b5c9e624c5b36424f808627",
    "mediaType": "image/png",
    "originType": "SYNTHETIC",
    "assetAvailability": "EXTERNAL_REFERENCE_ONLY",
    "sourceReference": "OpenScore/Lieder/38c5db510224d9facdc4b08d741fc788cfb58ea8/scores/Hensel,_Fanny/3_Lieder/2_Verlust/lc6013106.mxl#rendered-page-1-musescore-3.6.2",
    "licenseMetadata": {
      "dataset": "OpenScore Lieder Corpus",
      "version": "38c5db510224d9facdc4b08d741fc788cfb58ea8",
      "source": "OpenScore/Lieder",
      "license": "CC0-1.0",
      "redistributionStatus": "ALLOWED",
      "trainingAllowed": "YES",
      "evaluationAllowed": "YES",
      "commercialUseImplications": "ALLOWED"
    }
  },
  "gold": {
    "goldId": "openscore_lieder_osl_04_mxl_gold",
    "goldArtifactSha256": "eeb985968e1a8398f92b0aeac65e098692a9c71a62a3f458e2e9eec8d4f90f11",
    "goldFormat": "MUSICXML",
    "verificationStatus": "VERIFIED",
    "verifiedByRole": "TEACHER",
    "separateFromEngineOutputs": true,
    "teacherCorrectionAutomaticallyTrainingData": false,
    "trainingAuthorization": "NOT_AUTHORIZED"
  },
  "classification": {
    "notationClasses": [
      "PIANO_GRAND_STAFF"
    ],
    "notationFeatures": [
      "TIES",
      "SLURS",
      "ACCIDENTALS"
    ],
    "scanConditions": [
      "CLEAN_OR_HIGH_QUALITY"
    ]
  },
  "boundaries": {
    "researchEvaluationOnly": true,
    "engineOutputsStoredSeparately": true,
    "automaticWinnerSelection": false,
    "automaticMusicXmlMerge": false,
    "automaticSemanticRepair": false,
    "teacherAuthority": true,
    "productionDecisionAuthority": false
  }
}
