{
  "schemaVersion": "scoremosaic-polyphonic-benchmark-fixture-v1",
  "fixtureId": "poly_fixture_openscore_osl_01_p1",
  "granularity": "page",
  "location": {
    "pageIndex": 0
  },
  "source": {
    "sourceId": "openscore_lieder_osl_01_render_p1",
    "sourceSha256": "b6c7b641891fe718449f46a953b4d74dcdf005749c89cc28956cf46e3993d63e",
    "mediaType": "image/png",
    "originType": "SYNTHETIC",
    "assetAvailability": "EXTERNAL_REFERENCE_ONLY",
    "sourceReference": "OpenScore/Lieder/38c5db510224d9facdc4b08d741fc788cfb58ea8/scores/Schubert,_Franz/_/Das_Rosenband,_D.280/lc5946872.mxl#rendered-page-1-musescore-3.6.2",
    "licenseMetadata": {
      "dataset": "OpenScore Lieder Corpus",
      "version": "38c5db510224d9facdc4b08d741fc788cfb58ea8",
      "source": "OpenScore/Lieder",
      "license": "CC0-1.0",
      "redistributionStatus": "ALLOWED",
      "trainingAllowed": "YES",
      "evaluationAllowed": "YES",
      "commercialUseImplications": "ALLOWED"
    }
  },
  "gold": {
    "goldId": "openscore_lieder_osl_01_mxl_gold",
    "goldArtifactSha256": "a6798bffeae124d256acbd21d998baa215887126676739c2c5d19e7651d64c75",
    "goldFormat": "MUSICXML",
    "verificationStatus": "VERIFIED",
    "verifiedByRole": "TEACHER",
    "separateFromEngineOutputs": true,
    "teacherCorrectionAutomaticallyTrainingData": false,
    "trainingAuthorization": "NOT_AUTHORIZED"
  },
  "classification": {
    "notationClasses": [
      "PIANO_GRAND_STAFF"
    ],
    "notationFeatures": [
      "TIES",
      "SLURS",
      "GRACE_NOTES",
      "ACCIDENTALS"
    ],
    "scanConditions": [
      "CLEAN_OR_HIGH_QUALITY"
    ]
  },
  "boundaries": {
    "researchEvaluationOnly": true,
    "engineOutputsStoredSeparately": true,
    "automaticWinnerSelection": false,
    "automaticMusicXmlMerge": false,
    "automaticSemanticRepair": false,
    "teacherAuthority": true,
    "productionDecisionAuthority": false
  }
}
