{
  "schemaVersion": "scoremosaic-polyphonic-benchmark-fixture-v1",
  "fixtureId": "poly_fixture_openscore_osl_05_p1",
  "granularity": "page",
  "location": {
    "pageIndex": 0
  },
  "source": {
    "sourceId": "openscore_lieder_osl_05_render_p1",
    "sourceSha256": "b08adaa8bb7782c87bc978a4ced6620653d39914eb85aa45ec83880eaf7246e0",
    "mediaType": "image/png",
    "originType": "SYNTHETIC",
    "assetAvailability": "EXTERNAL_REFERENCE_ONLY",
    "sourceReference": "OpenScore/Lieder/38c5db510224d9facdc4b08d741fc788cfb58ea8/scores/Schumann,_Clara/_/Lorelei/lc4919673.mxl#rendered-page-1-musescore-3.6.2",
    "licenseMetadata": {
      "dataset": "OpenScore Lieder Corpus",
      "version": "38c5db510224d9facdc4b08d741fc788cfb58ea8",
      "source": "OpenScore/Lieder",
      "license": "CC0-1.0",
      "redistributionStatus": "ALLOWED",
      "trainingAllowed": "YES",
      "evaluationAllowed": "YES",
      "commercialUseImplications": "ALLOWED"
    }
  },
  "gold": {
    "goldId": "openscore_lieder_osl_05_mxl_gold",
    "goldArtifactSha256": "504dd02b4061e16d91750af5808a80abaa0cab04b955cb0b8f4b38cdd539eeac",
    "goldFormat": "MUSICXML",
    "verificationStatus": "VERIFIED",
    "verifiedByRole": "TEACHER",
    "separateFromEngineOutputs": true,
    "teacherCorrectionAutomaticallyTrainingData": false,
    "trainingAuthorization": "NOT_AUTHORIZED"
  },
  "classification": {
    "notationClasses": [
      "PIANO_GRAND_STAFF"
    ],
    "notationFeatures": [
      "TIES",
      "SLURS",
      "TUPLETS",
      "GRACE_NOTES",
      "ACCIDENTALS"
    ],
    "scanConditions": [
      "CLEAN_OR_HIGH_QUALITY"
    ]
  },
  "boundaries": {
    "researchEvaluationOnly": true,
    "engineOutputsStoredSeparately": true,
    "automaticWinnerSelection": false,
    "automaticMusicXmlMerge": false,
    "automaticSemanticRepair": false,
    "teacherAuthority": true,
    "productionDecisionAuthority": false
  }
}
