{
  "schemaVersion": "scoremosaic-polyphonic-benchmark-fixture-v1",
  "fixtureId": "poly_fixture_openscore_osl_03_p1",
  "granularity": "page",
  "location": {
    "pageIndex": 0
  },
  "source": {
    "sourceId": "openscore_lieder_osl_03_render_p1",
    "sourceSha256": "d6030170efd440a5c248385a02d46de89baac3b5214e0cf8bc28efd73f189bfb",
    "mediaType": "image/png",
    "originType": "SYNTHETIC",
    "assetAvailability": "EXTERNAL_REFERENCE_ONLY",
    "sourceReference": "OpenScore/Lieder/38c5db510224d9facdc4b08d741fc788cfb58ea8/scores/Brahms,_Johannes/2_Gesänge,_Op.91/2_Geistliches_Wiegenlied/lc6320420.mxl#rendered-page-1-musescore-3.6.2",
    "licenseMetadata": {
      "dataset": "OpenScore Lieder Corpus",
      "version": "38c5db510224d9facdc4b08d741fc788cfb58ea8",
      "source": "OpenScore/Lieder",
      "license": "CC0-1.0",
      "redistributionStatus": "ALLOWED",
      "trainingAllowed": "YES",
      "evaluationAllowed": "YES",
      "commercialUseImplications": "ALLOWED"
    }
  },
  "gold": {
    "goldId": "openscore_lieder_osl_03_mxl_gold",
    "goldArtifactSha256": "8ef00c7ac76c56b74c7183417bf8ea04068bb33a251dd5dbfe8e08f47797b250",
    "goldFormat": "MUSICXML",
    "verificationStatus": "VERIFIED",
    "verifiedByRole": "TEACHER",
    "separateFromEngineOutputs": true,
    "teacherCorrectionAutomaticallyTrainingData": false,
    "trainingAuthorization": "NOT_AUTHORIZED"
  },
  "classification": {
    "notationClasses": [
      "PIANO_GRAND_STAFF"
    ],
    "notationFeatures": [
      "TIES",
      "SLURS",
      "TUPLETS",
      "ACCIDENTALS"
    ],
    "scanConditions": [
      "CLEAN_OR_HIGH_QUALITY"
    ]
  },
  "boundaries": {
    "researchEvaluationOnly": true,
    "engineOutputsStoredSeparately": true,
    "automaticWinnerSelection": false,
    "automaticMusicXmlMerge": false,
    "automaticSemanticRepair": false,
    "teacherAuthority": true,
    "productionDecisionAuthority": false
  }
}
